{
  "$schema": "http://json-schema.org/draft-07/schema#",
  "$id": "curriculum.schema.json",
  "title": "CurriculumRegistry",
  "description": "Ordered list of topics defining the course curriculum. Each entry corresponds to exactly one topic Markdown file and one quiz JSON file.",
  "type": "array",
  "minItems": 1,
  "items": {
    "type": "object",
    "required": ["slug", "title", "examWeightPct", "order", "estimatedMinutes"],
    "additionalProperties": false,
    "properties": {
      "slug": {
        "type": "string",
        "pattern": "^[a-z][a-z0-9-]*[a-z0-9]$",
        "description": "Primary key. Must match: the topic file at src/content/topics/{slug}.md, the quiz file at src/content/quizzes/{slug}.json, and the slug field in each file's frontmatter / root object."
      },
      "title": {
        "type": "string",
        "minLength": 3,
        "description": "Display title for the curriculum index. Should match the topic frontmatter title."
      },
      "examWeightPct": {
        "type": "number",
        "minimum": 0,
        "maximum": 100,
        "description": "Approximate exam weight from the PSI CIB. Values are estimates; they need not sum to exactly 100."
      },
      "order": {
        "type": "integer",
        "minimum": 1,
        "description": "1-based display order in the curriculum index. Values must be unique across all entries."
      },
      "estimatedMinutes": {
        "type": "integer",
        "minimum": 1,
        "description": "Estimated total study time in minutes for the lesson + quiz pass."
      }
    }
  }
}
